Title,Company,Location,Category,Contract Type,Contract Time,Salary Min,Salary Max,Created,Description,Redirect URL,timestamp
Network Performance Officer,V/Line,"South Yarra, Stonnington Area",Admin Jobs,permanent,full_time,,,2025-01-17T11:09:52Z,"Permanent Full-Time Central CBD Office  Hybrid Working Flexibility Annual Leave Loading  Free myki Travel V/Line’s purpose is to connect Victorians through safe, reliable, and accessible transport. We believe in giving all Victorians opportunities through travel and transport – connecting them to jobs, education, family and friends, services, tourism and trade. V/Line is experiencing significant growth and we’re delivering more services, more trains, cheaper fares, and huge projects. With more …",https://www.adzuna.com.au/land/ad/5013671857?se=LiLRTjza7xGongxyKn7jYQ&utm_medium=api&utm_source=4a3e4881&v=5EC16133BA0B8208861AC472D70C308D4C02E55C,2025-01-24 21:31:41
"Staff Product Manager, Cash Management",Airwallex,"South Yarra, Stonnington Area",Accounting & Finance Jobs,,full_time,,,2025-01-17T10:58:30Z,"About Airwallex Airwallex is the only unified payments and financial platform for global businesses. Powered by our unique combination of proprietary infrastructure and software, we empower over 100,000 businesses worldwide – including Brex, Rippling, Navan, Qantas, SHEIN and many more – with fully integrated solutions to manage everything from business accounts, payments, spend management and treasury, to embedded finance at a global scale. Proudly founded in Melbourne, we have a team of over …",https://www.adzuna.com.au/land/ad/5013618346?se=LiLRTjza7xGongxyKn7jYQ&utm_medium=api&utm_source=4a3e4881&v=A3709894437E8702C54C385FB74F41FD46798EF1,2025-01-24 21:31:41
Senior Test Analyst - Data Program,GSB,Australia,IT Jobs,contract,,,,2025-01-21T21:49:45Z,"Senior Test Analyst – Data Program Great Southern Bank is seeking a Senior Test Analyst within the Data Program to execute the delivery of multiple projects and initiatives for a 6-month max term contract. This hybrid position is based in our Brisbane CBD office with the flexibility to work from home two days per week. You’ll make an impact by: • Proactively identify, evaluate, and mitigate potential risks and challenges, maintaining a solution-focused mindset throughout the data migration life…",https://www.adzuna.com.au/details/5018371871?utm_medium=api&utm_source=4a3e4881,2025-01-24 21:31:41
Data Engineer,Urbis,"South Yarra, Stonnington Area",IT Jobs,,full_time,,,2025-01-22T21:10:57Z,"About this role Who we are: Urbis is people focussed, and we want the best for our team, our clients, and our communities. We are a community of passionate problem solvers, sought out by clients for our fresh thinking and approach to their city-shaping projects. Our mission is to help create meaningful, sustainable cities & communities. Urbis is an employer of choice for gender equality (EOCGE), recognised through the Workplace Gender Equality Agency (WGEA), and active participants in the Feder…",https://www.adzuna.com.au/land/ad/5019459916?se=LiLRTjza7xGongxyKn7jYQ&utm_medium=api&utm_source=4a3e4881&v=E8CD55A18879366E144533ADEC4682C18628B1F6,2025-01-24 21:31:41
Data and Reporting Analyst / SQL Developer,APS,Australia,IT Jobs,,full_time,80748,80748,2025-01-17T17:30:34Z,"About our team DS Executive | Data & Economic Analysis Centre | Data Services | Statistics and Reporting Section We are a small specialist team that prepares and publishes a range of official statistics, statistical data products and customised statistics to inform the Minister's Office, program management, operational areas and policy development. We work closely across business areas to help shape data needs to support the Department's informed policymaking, program management and operational…",https://www.adzuna.com.au/details/5013876672?utm_medium=api&utm_source=4a3e4881,2025-01-24 21:31:41
Senior Business Analyst - Data and Technology,Assets and Operations,"New South Wales, Australia",IT Jobs,contract,full_time,,,2025-01-13T21:45:41Z,"Description We are unique Join an organisation that values your voice, empowers your autonomy, recognises the strength in diversity, and prioritises your well-being while offering attractive remuneration and benefits. Take pride in having a meaningful impact on regional, rural and remote communities while being a pivotal player in the energy industry's future. About the role We are currently recruiting for a Senior Business Analyst - Data & Technology to join the Essential Energy Operations Cha…",https://www.adzuna.com.au/details/5008514034?utm_medium=api&utm_source=4a3e4881,2025-01-24 21:31:41
"Senior Analyst, Data Collection Design",APRA,"The Rocks, Sydney",IT Jobs,,,,,2025-01-09T21:46:19Z,"The role The Senior Analyst contributes to the design and ongoing development of APRA’s taxonomy and data collections, as APRA continues its focus on transforming our technology and use of data. The role engages with various stakeholders to ensure our data collections can be used for prudential supervision and meets the needs of government. The team Data Collection Design (DCD) sits within the Data Collection Design and Management team, and part of the Chief Data Office function. DCD is respons…",https://www.adzuna.com.au/details/5003220683?utm_medium=api&utm_source=4a3e4881,2025-01-24 21:31:41
"Senior Analyst, Data Collection Design",APRA Talent,"Sydney, Sydney Region",IT Jobs,,,,,2025-01-07T21:50:24Z,"The role The Senior Analyst contributes to the design and ongoing development of APRA’s taxonomy and data collections, as APRA continues its focus on transforming our technology and use of data. The role engages with various stakeholders to ensure our data collections can be used for prudential supervision and meets the needs of government. The team Data Collection Design (DCD) sits within the Data Collection Design and Management team, and part of the Chief Data Office function. DCD is respons…",https://www.adzuna.com.au/details/5000681334?utm_medium=api&utm_source=4a3e4881,2025-01-24 21:31:41
Senior Data Engineer - GCP,Endava,"Melbourne, Melbourne Region",IT Jobs,,,,,2025-01-03T06:23:11Z,"Job Description Our data team has expertise across engineering, analysis, architecture, modeling, machine learning, artificial intelligence, and data science. This discipline is responsible for transforming raw data into actionable insights, building robust data infrastructures, and enabling data-driven decision-making and innovation through advanced analytics and predictive modeling. Responsibilities: Work closely with the Data Analyst/Data Scientist to understand evolving needs and define the…",https://www.adzuna.com.au/details/4995670373?utm_medium=api&utm_source=4a3e4881,2025-01-24 21:31:41
Senior Data Engineer - GCP,Endava,"Sydney, Sydney Region",IT Jobs,,,,,2025-01-03T06:23:11Z,"Job Description Our data team has expertise across engineering, analysis, architecture, modeling, machine learning, artificial intelligence, and data science. This discipline is responsible for transforming raw data into actionable insights, building robust data infrastructures, and enabling data-driven decision-making and innovation through advanced analytics and predictive modeling. Responsibilities: Work closely with the Data Analyst/Data Scientist to understand evolving needs and define the…",https://www.adzuna.com.au/details/4995670374?utm_medium=api&utm_source=4a3e4881,2025-01-24 21:31:41
Digital Solution Lead,Ashurst,"South Yarra, Stonnington Area",IT Jobs,,full_time,,,2025-01-17T10:58:50Z,"Job Title Digital Solution Lead Location Melbourne Description About Ashurst Advance: Ashurst Advance is Ashurst's NewLaw division that utilises market-leading technology, refined processes, and subject matter expertise in a wide array of technology-enabled legal and eDiscovery services that works alongside Ashurst's legal experts to solve our clients' business problems through optimal efficiency, cost effectiveness and digitally innovative legal service delivery. Our market leading offering ha…",https://www.adzuna.com.au/land/ad/5013620799?se=LiLRTjza7xGongxyKn7jYQ&utm_medium=api&utm_source=4a3e4881&v=EE87ADD5C0AE6BBED5D9945596966FAC88EB7C9D,2025-01-24 21:31:41
"Data Engineer - Azure, ADF, SSIS",FourQuarters,"Melbourne, Melbourne Region",IT Jobs,contract,full_time,165000,165000,2025-01-24T04:52:03Z,"Data Engineer required to support a number of data uplift initiatives for a leading financial services business. Responsibilities: Partner with Data Analysts and BI Developers to understand and define requirements Build, test and implement robust data pipelines using Azure Data Factory (ADF) Support and enhance existing SSIS solutions Enhance data consistency and reliability Ensure security and scalability of data solutions Requirements: Proven experience working in an on-prem and Azure Cloud d…",https://www.adzuna.com.au/details/5021288406?utm_medium=api&utm_source=4a3e4881,2025-01-24 21:31:41
Data Engineer,DXC Technology,"Macquarie Park, Ryde Area",IT Jobs,,full_time,,,2025-01-17T10:52:29Z,"Job Description: DXC Technology (NYSE: DXC) helps global companies run their mission-critical systems and operations while modernizing IT, optimizing data architectures, and ensuring security and scalability across public, private and hybrid clouds. The world's largest companies and public sector organizations trust DXC to deploy services to drive new levels of performance, competitiveness, and customer experience across their IT estates. Learn more about how we deliver excellence for our custo…",https://www.adzuna.com.au/land/ad/5013580879?se=LiLRTjza7xGongxyKn7jYQ&utm_medium=api&utm_source=4a3e4881&v=0190B810E8E4B3B613014AA82CFB7AEE3942C527,2025-01-24 21:31:41
"Product Owner / Chapter Lead, Migration Analytics",ANZ,"South Yarra, Stonnington Area",IT Jobs,permanent,full_time,,,2025-01-17T11:10:03Z,"About Us At ANZ, we're shaping a world where people and communities thrive, driven by a common goal: to improve the financial wellbeing and sustainability of our millions of customers. About the Role We are looking for an exceptional Product Owner/Chapter Lead , Analytics to join our growing team. You’ll lead the development of advanced analytics capabilities that empower data-informed decision-making across ANZ with a specific focus on data migration. Combining strategic vision with hands-on l…",https://www.adzuna.com.au/land/ad/5013672786?se=LiLRTjza7xGongxyKn7jYQ&utm_medium=api&utm_source=4a3e4881&v=79C3DEA00C4D14F5FE2447ECD6846169C8079024,2025-01-24 21:31:41
Platform Engineer,REO Group,"The Rocks, Sydney",IT Jobs,,full_time,,,2025-01-22T09:14:09Z,"Job Description Location: Sydney CBD Salary Package: $160,000 - $180,000  Super  Performance Bonus Role Highlights: Seize a career-defining opportunity to join a prominent energy solutions provider. This role allows you to significantly impact the company's cloud infrastructure and data analytics platform, contributing to its long-term stability and performance. Role Overview: As a Platform Engineer, you will play a critical role in managing and optimising our cloud-based infrastructure. Report…",https://www.adzuna.com.au/land/ad/5018860576?se=LiLRTjza7xGongxyKn7jYQ&utm_medium=api&utm_source=4a3e4881&v=584182ABDB3CE7EE0FAF8F7EB7837EAA4BFEB62D,2025-01-24 21:31:41
"Manager, Educational Data & Insights",University of New South Wales,"The Rocks, Sydney",Teaching Jobs,contract,full_time,,,2025-01-23T09:25:49Z,"Employment Type: Full-Time (35-hour week) Duration: 12-month fixed term contract until January 2026 Remuneration: Level 8 from $123k Location: Kensington NSW (Hybrid Flexible Working) Why your role matters The Manager of Educational Data & Insights holds a pivotal position within the Educational Data & Insights team, part of the Deputy Vice Chancellor – Academic Quality portfolio. This role is instrumental in preparing and distributing student survey data, analytics and benchmarking, contributi…",https://www.adzuna.com.au/land/ad/5020245603?se=LiLRTjza7xGongxyKn7jYQ&utm_medium=api&utm_source=4a3e4881&v=F08FCF51705D8C1882D2C98A970BDA4F5AD24B38,2025-01-24 21:31:41
Senior Machine Learning Engineer/Data Scientist,ANZ,"South Yarra, Stonnington Area",IT Jobs,permanent,full_time,,,2025-01-17T11:08:14Z,"About Us At ANZ, we're applying new ways technology and data can be harnessed as we work towards a common goal: to improve the financial wellbeing and sustainability of our millions of customers. About the Role As a Machine Learning Engineer/Data Scientist at ANZ, you are accountable for building advanced models to understand and solve complex data problems through advanced modelling. Working with Data Engineers and Data Analysts you will determine the relevant internal and external data source…",https://www.adzuna.com.au/land/ad/5013665064?se=LiLRTjza7xGongxyKn7jYQ&utm_medium=api&utm_source=4a3e4881&v=6BEDBE1080C8DE7AF62E412CEB80D918C044EDF3,2025-01-24 21:31:41
Data Engineering Manager Mid-Senior Level,Keypath Education,"South Yarra, Stonnington Area",IT Jobs,,full_time,,,2025-01-17T11:01:53Z,"Company Description Discover Your Path at Keypath About Us: At Keypath, we invite you to be part of something transformative. As a global EdTech leader, we collaborate with prestigious universities to create and deliver online education solutions that tackle global social and economic challenges head-on. Join our dynamic, fast-growing international team that thrives on collaboration, innovation, and lifelong learning. With offices in Melbourne, Sydney, Chicago, and SE Asia, we are truly a globa…",https://www.adzuna.com.au/land/ad/5013637381?se=LiLRTjza7xGongxyKn7jYQ&utm_medium=api&utm_source=4a3e4881&v=DD7E9B8F12138BB1FA24DF2F5EA6399F406F1452,2025-01-24 21:31:41
Lead Data Engineer,Cuscal Limited,"The Rocks, Sydney",IT Jobs,,full_time,,,2025-01-17T10:55:49Z,"Company Description For a winning team that is evolving. Forward with Cuscal. At Cuscal, you’ll find a strong, successful company that’s reimagining the future. And our team is right there at the heart of it all. Here, you’ll deliver or support interesting, ground-breaking projects that have real impact - on Australia’s financial services sector and the millions of customers it serves. You’ll innovate alongside skilled, smart, connected teams. And you’ll build an impressive, fulfilling career t…",https://www.adzuna.com.au/land/ad/5013600052?se=LiLRTjza7xGongxyKn7jYQ&utm_medium=api&utm_source=4a3e4881&v=7766C461E204FBAD7C63994A4D4F12663097879C,2025-01-24 21:31:41
Business Analyst,ALDI Stores,"Minchinbury, Blacktown Area",IT Jobs,,,,,2025-01-03T06:23:11Z,"Job Description An exciting opportunity in the Use Cases team has become available within our National Data and Analytics (NDA) department of ALDI stores, based in Minchinbury. This is a permanent full-time position . As a Business Data Analyst specialising in data modelling, you will be involved in the development of national use cases and their associated impact measurement. You will leverage data analysis for actionable insights, strategic recommendations, and proficiently conduct A/B tests …",https://www.adzuna.com.au/details/4995670369?utm_medium=api&utm_source=4a3e4881,2025-01-24 21:31:41
Evidence Analyst (Systematic Reviews and Data Analysis),University of Sydney,"Camperdown, Marrickville Area",Scientific & QA Jobs,contract,full_time,,,2025-01-21T21:15:42Z,"Full-time fixed term for 12 months based at Camperdown Opportunity to support evidence-based research from clinical trials Base Salary $99,455  17% superannuation About the opportunity The NHMRC Clinical Trials Centre (CTC) established in 1988, is a leading Australian Academic Research Organisation with a world class international reputation for designing conducting and translating collaborative clinical trials research into improved health care practice. The CTC is also known for its innovatio…",https://www.adzuna.com.au/land/ad/5018324403?se=RgHMUjza7xGongxyKn7jYQ&utm_medium=api&utm_source=4a3e4881&v=C5656F63B629106303653029957B6DA5C2CA758D,2025-01-24 21:31:41
Data Compliance and Assurance Analyst,APS,Australia,IT Jobs,,full_time,,,2025-01-24T17:34:35Z,"The key duties of the position include Sydney or Melbourne location Salary from $123,444  15.4% superannuation (depending on experience) Hybrid working environment A future with ASIC means that your work will contribute to ASIC's vision for a fair, strong and efficient financial system for all Australians. We value what you will bring. We value those with sharp, analytical minds and are open to challenging the way things are done. The team The Data Governance team is responsible for developing …",https://www.adzuna.com.au/details/5021943741?utm_medium=api&utm_source=4a3e4881,2025-01-24 21:31:41
Data Compliance and Assurance Analyst,ASIC,Australia,IT Jobs,permanent,full_time,,,2025-01-22T16:46:45Z," Sydney or Melbourne location  Salary from $123,444  15.4% superannuation (depending on experience)  Hybrid working environment A future with ASIC means that your work will contribute to ASIC's vision for a fair, strong and efficient financial system for all Australians. We value what you will bring. We value those with sharp, analytical minds and are open to challenging the way things are done. The team The Data Governance team is responsible for developing and implementing ASIC's data strateg…",https://www.adzuna.com.au/details/5019071669?utm_medium=api&utm_source=4a3e4881,2025-01-24 21:31:41
Modern Data Platform Lead,DXC Technology,"South Yarra, Stonnington Area",IT Jobs,,full_time,,,2025-01-17T10:51:42Z,"Job Description: DXC Technology (NYSE:DXC) - where brilliant people embrace change and seize opportunities to advance their careers and amplify customer success. People are the heart of our business. We support each other and work as a team, globally and locally to deliver excellence for our customers and colleagues. We live in more than 70 countries, speak multiple languages and work with over 6,000 customers on almost every continent. We use the power of technology to deliver technology servi…",https://www.adzuna.com.au/land/ad/5013576919?se=RgHMUjza7xGongxyKn7jYQ&utm_medium=api&utm_source=4a3e4881&v=44FA409B522C238FA2133445EE487D29906A9F33,2025-01-24 21:31:41
Data Engineering Manager,Keypath Education,"Melbourne, Melbourne Region","Energy, Oil & Gas Jobs",,,,,2025-01-07T00:29:14Z,"Job Description The Data Engineering Manager will work closely with leaders across marketing, recruitment, student services and finance to support and implement high-quality, data-driven decisions and technologies that optimize the student experience. They will establish and deliver a data and analytics strategy and roadmap, supporting strategic initiatives by providing analysis services, statistical and predictive models, data visualization and reporting systems. The Data Engineering Manager w…",https://www.adzuna.com.au/details/4999711800?utm_medium=api&utm_source=4a3e4881,2025-01-24 21:31:41
Commercial Manager,Auto & General,"Mango Hill, Pine Rivers Area",Accounting & Finance Jobs,,full_time,,,2025-01-17T10:53:30Z,"The role Join the Supply Relationship Leadership team as a Commercial Manager where you will be working amongst a team of claims professionals responsible for ensuring Auto and General has the best-in-class motor supply network. Your core focus will be utilising supplier performance data and surfacing insights to help the teams in the field improve network capacity and customer outcomes. You will be working on dynamic and varied datasets with and making best use of your problem solving, root ca…",https://www.adzuna.com.au/land/ad/5013586817?se=RgHMUjza7xGongxyKn7jYQ&utm_medium=api&utm_source=4a3e4881&v=27E246B7268077C332815331099053A113254230,2025-01-24 21:31:41
"Data Modeler (GCP, BigQuery, Spatial Data)",Capgemini,"South Yarra, Stonnington Area",IT Jobs,,full_time,,,2025-01-17T11:06:59Z,"Come and join a thriving company and become part of a diverse global collective of free-thinkers, entrepreneurs and industry experts who are all driven to use technology to reimagine what’s possible. Capgemini. Get the future you want. For more about why Capgemini https://www.capgemini.com/au-en/careers/why-join-capgemini/ Let’s talk about the roles and responsibilities We are seeking a skilled and experienced Data Modeler to design and implement cutting-edge data models for sustainability repo…",https://www.adzuna.com.au/land/ad/5013659381?se=RgHMUjza7xGongxyKn7jYQ&utm_medium=api&utm_source=4a3e4881&v=4670EB20AA0429BCD91CCD9684F4083566D1FDC9,2025-01-24 21:31:41
Data Steward,BDO Administration Pty,"East Brisbane, Brisbane",IT Jobs,,full_time,,,2025-01-17T21:50:25Z,"About BDO At BDO Australia, our why is ‘empowering people, realising possibilities’. One way we bring this to life is by hiring and developing exceptional talent, to deliver on our wide array of audit, tax and advisory services. About the Role If you’re passionate about data and are looking for a career-defining opportunity, this role is for you The Enterprise Data, Reporting & Analytics team is an internal-facing team, delivering exceptional data management services for Shared Services and Cli…",https://www.adzuna.com.au/details/5014216911?utm_medium=api&utm_source=4a3e4881,2025-01-24 21:31:41
Senior Administration Officer,ADA Australia,"Zillmere, Brisbane",Accounting & Finance Jobs,permanent,full_time,89440,91520,2025-01-09T17:45:38Z,"• Permanent, full-time opportunity • $43.08 per hour  generous salary packaging options • Based at Geebung  WFH flexibility About Us ADA Australia is a statewide, not-for-profit, independent, community-based advocacy and education service, supporting and improving the wellbeing of older people and people with disability. About the Role In this dynamic and diverse role, you will report directly to the Team Leader of Business Support Services, delivering high-level administrative support to teams…",https://www.adzuna.com.au/details/5003036012?utm_medium=api&utm_source=4a3e4881,2025-01-24 21:31:41
Databricks Architect,Accenture,"Queensland, Australia",IT Jobs,,full_time,,,2025-01-17T10:52:37Z,"Job Description Project Description: Data Modernization/GenAI Join a global technology transformation practice and take the lead across designing, building, and maintaining data pipelines and analytics solutions on the Databricks cloud platform and collaborate with data analysts and customer stakeholders to ensure the availability, scalability, and reliability of data. The consultative and personable Data Engineering Leader will provide advice and leading expertise on Databricks and have a deep…",https://www.adzuna.com.au/land/ad/5013581618?se=RgHMUjza7xGongxyKn7jYQ&utm_medium=api&utm_source=4a3e4881&v=4A9F6B366EACE53F19428D7D7BD9A530445330DF,2025-01-24 21:31:41
Data Scientist,SKL Actuarial,"The Rocks, Sydney",IT Jobs,permanent,full_time,,,2025-01-17T10:50:00Z,"Permanent role with a market-leader in the consulting space. Opportunity to work with a broad range of high-profile clients Our client is specialist consulting firm with a wealth of clients in the insurance, banking and government sectors. The team is made up of professionals with a range of educational backgrounds and technical skillsets across analytics, modelling, machine learning and visualisation. They are looking for individuals who share their passion for problem solving and improving bu…",https://www.adzuna.com.au/land/ad/5013568021?se=RgHMUjza7xGongxyKn7jYQ&utm_medium=api&utm_source=4a3e4881&v=9A192D5BA786D2A44C91A5469068CEC32D221D64,2025-01-24 21:31:41
Data Reporting Lead,Job Details,"Melbourne CBD, Melbourne",IT Jobs,,full_time,,,2025-01-18T21:49:38Z,"David Jones exists to inspire like no other and as we continue to deliver on our ambitious transformation agenda in line with our Vision 2025 strategy, we are committed to creating inspired careers so our people can Thrive. The Data Reporting Lead is a key role within the Data Team, responsible for providing technical leadership to a team of data analysts and reporting specialists. This role requires a deep understanding of data analytics, reporting tools, and the ability to translate business …",https://www.adzuna.com.au/details/5015600019?utm_medium=api&utm_source=4a3e4881,2025-01-24 21:31:41
Lead Analyst – Enterprise Data Quality,Stryker,Australia,IT Jobs,,full_time,,,2024-12-30T21:02:41Z,"Work Flexibility: Hybrid Stryker Stryker is one of the world’s leading medical technology companies and together with our customers, is driven to make healthcare better. Stryker offers innovative products and services in Medical and Surgical, Neurotechnology, Orthopedics, and Spine that help improve patient and healthcare outcomes. Alongside its customers around the world, Stryker impacts more than 100 million patients annually. The role: The Lead Analyst – Enterprise Data Quality role is criti…",https://www.adzuna.com.au/details/4992106058?utm_medium=api&utm_source=4a3e4881,2025-01-24 21:31:41
Aurora Neuroinclusion Program - Affirmative Measures (Disability - autism spectrum disorder/condition or attention deficit/hyperactivity disorder),APS,"Brisbane, Brisbane Region",Teaching Jobs,,full_time,82427,82427,2025-01-14T17:28:20Z,"Services Australia will be using the Aurora Neuroinclusion Program to attract, assess and place work ready candidates with autism spectrum disorder/condition or attention deficit/hyperactivity disorder (ADHD) into specialised roles across the agency. Aurora recognises the unique skills and talents neurodivergent people can bring to work. It seeks to improve career outcomes and provides professional development by providing a gateway to the Australian Public Service. About the program The Aurora…",https://www.adzuna.com.au/details/5009636867?utm_medium=api&utm_source=4a3e4881,2025-01-24 21:31:41
