Title,Company,Location,Category,Contract Type,Contract Time,Salary Min,Salary Max,Created,Description,Redirect URL,timestamp
Data Analyst,Talent International,"Geelong West, Geelong",IT Jobs,,full_time,,,2025-01-17T11:02:13Z,"Working for this large government department as a Data Analyst you will be part of the People & Culture team. Your role will be to develop reporting and analytical capability to enable decision making and insight to the business by connecting P&C metrics to business unit and corporate strategy delivery and self-service access to information where possible. Key activities Collaborate with the P&C division to provide the data, analysis and insights required to deliver the organisation’s corporate…",https://www.adzuna.com.au/land/ad/5013639148?se=tt9VNDza7xGongxyKn7jYQ&utm_medium=api&utm_source=4a3e4881&v=69D1C0D5A21253DB1EC71A5E429019D78B2B9E27,2025-01-24 21:31:41
Data Analyst,Luxury Escapes,"The Rocks, Sydney",IT Jobs,,full_time,,,2025-01-17T11:02:26Z,"Luxury Escapes is one of the world's fastest growing travel businesses, reaching up to 7 million subscribers each month with exclusive limited time offers at 'insider' prices. Here at Luxury Escapes, our mission is to delight our customers with incredible deals for the world's best holidays. We are a collective of forward-thinking people, driven to challenge the travel industry and ourselves to bring ever better travel experiences to our customer community. Our award winning employee experience…",https://www.adzuna.com.au/land/ad/5013640202?se=tt9VNDza7xGongxyKn7jYQ&utm_medium=api&utm_source=4a3e4881&v=89C32590C40E5509C6287C3401EAFA802FA3FF5E,2025-01-24 21:31:41
Data Analyst,WorkSafe Victoria,"Geelong West, Geelong",IT Jobs,contract,full_time,,,2025-01-17T11:10:38Z,"Data Analyst $96,849 per annum  superannuation Full time, Fixed term opportunity until 30 June 2025 Geelong location (hybrid working model – minimum 3 days in office attendance) At WorkSafe we’re dedicated to supporting all Victorians to be healthy and safe at work and to recover from any workplace injury or illness as quickly as possible. Our passion for safety and wellbeing is what unites us. About the role WorkSafe Victoria (WSV) is committed to supporting prevention-led and client-centric d…",https://www.adzuna.com.au/land/ad/5013676392?se=tt9VNDza7xGongxyKn7jYQ&utm_medium=api&utm_source=4a3e4881&v=2E8B0259325FC087E7512270C9246429C7405F6B,2025-01-24 21:31:41
Data Analyst,HorizonOne Recruitment,"Braddon, North Canberra",IT Jobs,contract,full_time,,,2025-01-23T09:25:46Z,"Exclusive role | Managing & executing SAS data flows | Long term contract ASAP - 14/11/25 | Work culture where people enjoy coming to work This opportunity is in a large APS agency, joining a team focused on using data to drive evidence-based reforms in Australia. This group specialises in gathering and analysing information to support informed decision-making. The team’s goal is to foster a data-centric environment, ensuring that insights are leveraged to their fullest potential. The Opportuni…",https://www.adzuna.com.au/land/ad/5020245404?se=tt9VNDza7xGongxyKn7jYQ&utm_medium=api&utm_source=4a3e4881&v=6ADC3834726A1E518E858A6954E4C478D7F196B6,2025-01-24 21:31:41
Data Analyst,Easy Authoring,"The Rocks, Sydney",IT Jobs,,full_time,,,2025-01-17T11:02:58Z,"Contract until 20th April 2025, with possible extension. Competitive pay: $890 / day  super Full-time role: 40 hours per week, with flexible working options (3 days onsite, 2 days WFH) Office location: Parramatta Purpose of the Role: We’re seeking a Data Analyst with Fleet Management or Asset Management experience to design, develop, implement and support Business Intelligence solutions for a key team within a large state government department. This role will focus on leveraging tools like Powe…",https://www.adzuna.com.au/land/ad/5013643327?se=tt9VNDza7xGongxyKn7jYQ&utm_medium=api&utm_source=4a3e4881&v=492C1CC1D96FED143B6153CFF6E316D1D0B15A2B,2025-01-24 21:31:41
Data Analyst,HorizonOne Recruitment,"Braddon, North Canberra",IT Jobs,permanent,full_time,,,2025-01-17T11:00:20Z,"Is 2025 the year you find your dream data analyst role. Get access to a wide variety (including exclusive) contract & s26 data & analytical roles HorizonOne Recruitment is a specialist recruitment firm redefining traditional approaches. With a focus on quality, service, and deep subject-matter expertise, we prioritize candidates, tailoring our efforts to find the best possible fit. Our reverse-recruiting model puts you at the centre, coaching you through career planning and helping you navigate…",https://www.adzuna.com.au/land/ad/5013628602?se=tt9VNDza7xGongxyKn7jYQ&utm_medium=api&utm_source=4a3e4881&v=9523ACDC50AD4E8A9F0BFA1A918266A23EB6F568,2025-01-24 21:31:41
Data Analyst,at Sonder.io,"Waterloo, Sydney",Consultancy Jobs,,full_time,,,2025-01-22T13:10:24Z,"At Sonder, we help organisations improve the health, safety and wellbeing of their people, empowering them to be at their best. Our mobile app provides immediate, 24/7 support to our members from a team of safety, medical, and mental health professionals - plus onsite help for time-sensitive scenarios. Accredited by the Australian Council on Healthcare Standards (ACHS), our platform gives our customers the insights they need to act on tomorrow’s wellbeing challenges today. Founded in 2017, Sond…",https://www.adzuna.com.au/land/ad/5018999081?se=tt9VNDza7xGongxyKn7jYQ&utm_medium=api&utm_source=4a3e4881&v=61F4E866CA69CEC49CE79C93550951D3BB75F453,2025-01-24 21:31:41
Data Analyst,Brunel,"Bayswater, Bayswater Area",IT Jobs,contract,part_time,,,2025-01-17T11:09:12Z,"What are you going to do li]:text-brunel-dark-grey [&_ul>li]:py-2 [&_p]:text-brunel-dark-grey [&_ul>li>ul>li]:pl-0 pl-4 text-brunel-dark-grey description""> We have a current opportunity for a Analyst on a temporary basis. The position will be based in Perth. For further information about this position please apply. Responsibilities: Prepare financial analysis reports to assess operational performance for regular reporting and specific business needs. Deliver high-quality analysis and insights t…",https://www.adzuna.com.au/land/ad/5013669202?se=tt9VNDza7xGongxyKn7jYQ&utm_medium=api&utm_source=4a3e4881&v=F54E7F9B7917EA85BC0022BFAE7C185C1A99509B,2025-01-24 21:31:41
Data Analyst,CHEP Network,"The Rocks, Sydney","PR, Advertising & Marketing Jobs",,full_time,,,2025-01-18T11:04:48Z,"Job Description WE ARE LOOKING FOR THE NEW BREED OF ANALYST We're looking for someone with a baseline knowledge of analytics, marketing science or data science, but more importantly, we want someone who brings a passion for uncovering insights, a proactive attitude, and an eagerness to learn and grow. You're someone who's fascinated by human behavior and the why behind how marketing works. Data is the foundation of every business strategy, and we need someone who not only understands the number…",https://www.adzuna.com.au/land/ad/5015083563?se=tt9VNDza7xGongxyKn7jYQ&utm_medium=api&utm_source=4a3e4881&v=07DF986ECBA4E7C6703C03E399B33E6F23F5BAEB,2025-01-24 21:31:41
Data Analyst,Queensland Government,"Brisbane CBD, Brisbane",IT Jobs,permanent,full_time,101174,109783,2025-01-17T11:07:49Z,"Department of Queensland Treasury Permanent Flexible full-time $101,174 - $109,783 per annum Generous Superannuation Undertake person based probabilistic data linkage in a collaborative environment committed to continuous improvement and innovation. The key responsibilities Access, process, link, analyse and manage data using tools such as R, GitLab and customised data linkage software. Ensure outputs satisfy QGSO standards for integrity, governance, accuracy and timeliness. Contribute to the d…",https://www.adzuna.com.au/land/ad/5013663315?se=tt9VNDza7xGongxyKn7jYQ&utm_medium=api&utm_source=4a3e4881&v=32AAE99F1A52CE433086B7C62075FBC7CBED8C29,2025-01-24 21:31:41
Data Analyst,Macquarie,"The Rocks, Sydney",Accounting & Finance Jobs,,full_time,,,2025-01-17T10:52:45Z,"Join our Data Change team and support the delivery of our Data Transformation initiative - one of the many exciting change transformations happening across Macquarie. We provide data solutions that facilitate effective data management, data-driven insights, and data automation within our Commodities and Global Markets group. At the forefront of the dynamic data landscape, we value you, your development, and the ideas you contribute to our vibrant organisation. At Macquarie, our advantage is bri…",https://www.adzuna.com.au/land/ad/5013582322?se=tt9VNDza7xGongxyKn7jYQ&utm_medium=api&utm_source=4a3e4881&v=9CAE494E2E8F98C26D302DDDBEFD62096D981C4E,2025-01-24 21:31:41
Technical Data Analyst/ Senior Technical Data Analyst,Commonwealth Bank of Australia,"Sydney CBD, Sydney",IT Jobs,,full_time,,,2025-01-18T11:05:12Z,"Do work that matters We’re a global data and analytics team with a customer-led mindset committed to building a brighter future for all. Our vision is to build and deliver world-class experiences for our customers using the power of data, analytics and artificial intelligence (AI). To us, data is everything, it’s what powers our cutting-edge features and the reason we can provide seamless experiences for our customers from the branch on your street to the app on your phone. See yourself in our …",https://www.adzuna.com.au/land/ad/5015087201?se=tt9VNDza7xGongxyKn7jYQ&utm_medium=api&utm_source=4a3e4881&v=8F03C11D2A35A43DE292BC55F4AA9C03409EFF4C,2025-01-24 21:31:41
Spatial Data Analyst,EBR,"The Rocks, Sydney",Admin Jobs,,full_time,,,2025-01-17T10:49:18Z,"Title: Spatial Data Analyst About the position As a Spatial Data Analyst , you will be undertaking the acquisition, analysis, interpretation, manipulation, and dissemination of vehicle, driver shift, spatial and other bus service data to support network systems and public transport customer information products. What you will do for us Ensure quality and integrity of customer data Utilize computer-based planning, scheduling and statistical tools to report on service performance, customer feedba…",https://www.adzuna.com.au/land/ad/5013563824?se=tt9VNDza7xGongxyKn7jYQ&utm_medium=api&utm_source=4a3e4881&v=32AFF0ADA0DFBC341349D5E764A92CEBCB4468AB,2025-01-24 21:31:41
Paralympic Data Analyst,Australian Sports Commission,"City, North Canberra",IT Jobs,contract,full_time,,,2025-01-21T21:16:07Z,"$102,137 - $117,758  up to 15.4% superannuation - ASC Grade 5 Canberra,Melbourne Fixed Term Full Time Applications close at 11:30pm AEDT Monday, 3 February 2025 (late applications will not be accepted). The Australian Sports Commission is embarking on the Green and Gold decade. An exciting time filled with international sporting competitions on home soil, including the Men’s and Women’s Rugby World Cup, and culminating in the Brisbane 2032 Olympic and Paralympic Games. We have an ambitious new …",https://www.adzuna.com.au/land/ad/5018326235?se=tt9VNDza7xGongxyKn7jYQ&utm_medium=api&utm_source=4a3e4881&v=D4BC70E1C0D3A9737404401611FEF7BB47DD5273,2025-01-24 21:31:41
Paralympic Data Analyst,Australian Sports Commission,"South Yarra, Stonnington Area",IT Jobs,contract,full_time,,,2025-01-21T21:16:07Z,"$102,137 - $117,758  up to 15.4% superannuation - ASC Grade 5 Canberra,Melbourne Fixed Term Full Time Applications close at 11:30pm AEDT Monday, 3 February 2025 (late applications will not be accepted). The Australian Sports Commission is embarking on the Green and Gold decade. An exciting time filled with international sporting competitions on home soil, including the Men’s and Women’s Rugby World Cup, and culminating in the Brisbane 2032 Olympic and Paralympic Games. We have an ambitious new …",https://www.adzuna.com.au/land/ad/5018326231?se=tt9VNDza7xGongxyKn7jYQ&utm_medium=api&utm_source=4a3e4881&v=0399A654010F8A821F17530678D4B7726B975FDD,2025-01-24 21:31:41
Technical Data Analyst,Urban Utilities,"Fortitude Valley, Brisbane",IT Jobs,permanent,full_time,,,2025-01-17T11:10:36Z,"Permanent Full Time, 38hr week $44.20/hr base  super (up to 14%)  leave loading Location: Fortitude Valley with hybrid and flexible working arrangements There’s No Us Without U. Care with Us, for Today and Tomorrow There's no life without water, and at Urban Utilities, we live and breathe that knowledge every single day. It's why our people are so passionate about what they do and how they do it. And it's why we need people like YOU . Come shape our future with us and make a real and lasting im…",https://www.adzuna.com.au/land/ad/5013676112?se=tt9VNDza7xGongxyKn7jYQ&utm_medium=api&utm_source=4a3e4881&v=756E4E2B649887671ED84A5B5DE8AC4A5997C413,2025-01-24 21:31:41
SAS Data Analyst,NCS Australia,"The Rocks, Sydney",IT Jobs,,full_time,,,2025-01-17T11:11:17Z,"Company Description About us: At NCS Australia, we believe in doing technology services better. Our commitment to quality, focus on people, and willingness to challenge traditional thinking set us apart. Our team brings this belief to life by partnering with our clients and communities to make tomorrow together. We are committed to creating an environment that prioritises innovation, collaboration, and purposeful work. Our diverse team is empowered to make a meaningful impact with curiosity, cr…",https://www.adzuna.com.au/land/ad/5013681420?se=tt9VNDza7xGongxyKn7jYQ&utm_medium=api&utm_source=4a3e4881&v=F71F2E34B89FCC7F3B754361B6F65F6E6FA0CADB,2025-01-24 21:31:41
SAS Data Analyst,NCS Australia,"City, North Canberra",IT Jobs,,full_time,,,2025-01-17T11:11:17Z,"Company Description About us: At NCS Australia, we believe in doing technology services better. Our commitment to quality, focus on people, and willingness to challenge traditional thinking set us apart. Our team brings this belief to life by partnering with our clients and communities to make tomorrow together. We are committed to creating an environment that prioritises innovation, collaboration, and purposeful work. Our diverse team is empowered to make a meaningful impact with curiosity, cr…",https://www.adzuna.com.au/land/ad/5013681415?se=tt9VNDza7xGongxyKn7jYQ&utm_medium=api&utm_source=4a3e4881&v=6B6498689F73802B5C1AD4B7C7AC1098F804FACA,2025-01-24 21:31:41
Senior Data Analyst,COLONIAL FIRST STATE,"The Rocks, Sydney",IT Jobs,,full_time,,,2025-01-18T11:05:02Z,"Are you ready to be part of an organisation that values expertise, passion and diversity? At CFS we know that the foundation of our success lies in our exceptional people. We believe in celebrating individuality, have a passion for high performance and creating an environment where you can unleash your full potential. Our people enable us to make a difference and deliver exceptional experiences to help our customers achieve financial freedom. Your Team The Technology, Transformation and Operati…",https://www.adzuna.com.au/land/ad/5015085763?se=tt9VNDza7xGongxyKn7jYQ&utm_medium=api&utm_source=4a3e4881&v=2F8E14493AEAEAACF6C063C0F2F48E67CDAEFA76,2025-01-24 21:31:41
Master Data Analyst,Bega Cheese,"World Trade Centre, Melbourne",IT Jobs,,full_time,,,2025-01-18T11:05:17Z,"If you are curious & creative, invested in not only your own success but also the growth of others, and believe in building the Great Australian Food Company, then you might be the one for us The Role We have an exciting opportunity within the Finance team to own, oversee, and manage Bega Group's supplier data, from creation, maintaining, supporting and offboarding, The Master Data Analyst will enjoy working in a fast-paced environment, navigating between systems and stakeholders, and has high …",https://www.adzuna.com.au/land/ad/5015087986?se=tt9VNDza7xGongxyKn7jYQ&utm_medium=api&utm_source=4a3e4881&v=646D232D746C6980387606EC6582F982D8E980CD,2025-01-24 21:31:41
Senior Data Analyst,Endeavour Group,"Surry Hills, Sydney",IT Jobs,,full_time,,,2025-01-21T21:15:39Z,"Company Description Let’s create a more sociable future together At Endeavour, we’re totally into what we do. With a portfolio that includes Dan Murphy’s, BWS, ALH Hotels, Pinnacle Drinks and more, we love to bring people together. Together we share our passion for our products and industry; it’s what inspires us to dream big, and continue to create new experiences for our customers and teams across Australia. If you thrive on positive energy, we want to meet you Job Description Bring your pass…",https://www.adzuna.com.au/land/ad/5018324258?se=tt9VNDza7xGongxyKn7jYQ&utm_medium=api&utm_source=4a3e4881&v=3F5E768C8E378E724BD3EA7C1C89B2DF1A216EC3,2025-01-24 21:31:41
Financial Data Analyst,Macquarie,"The Rocks, Sydney",Accounting & Finance Jobs,,full_time,,,2025-01-17T10:52:51Z,"Join our Commodities Global Markets business as an enthusiastic and innovative Analyst. We ensure that Commodities Global Markets data is accurately and appropriately maintained for compliance with global regulations and internal policies with regards to completeness, quality, and timeliness. At Macquarie, our advantage is bringing together diverse people and empowering them to shape all kinds of possibilities. We are a global financial services group operating in 34 markets and with 55 years o…",https://www.adzuna.com.au/land/ad/5013582936?se=tt9VNDza7xGongxyKn7jYQ&utm_medium=api&utm_source=4a3e4881&v=043DE5A32DC7DD1918DFDDC33F5388F3BA20A6FC,2025-01-24 21:31:41
Financial Data Analyst,Duratec,"Bayswater, Bayswater Area",IT Jobs,,full_time,120,140,2025-01-17T10:56:01Z,"Full-time role based in Wangara Flexible working Multi-state presence, market leading contractor THE ROLE Data Accuracy Maintenance: Ensure the accuracy and consistency of financial data across all databases. Month-End Reporting: Manage the month-end reporting process by coordinating between the various data teams and validating data accuracy and ensuring data is correctly reconciled. Budget and Forecast Support: Provide technical assistance to the Finance team during budgeting and forecasting …",https://www.adzuna.com.au/land/ad/5013601138?se=tt9VNDza7xGongxyKn7jYQ&utm_medium=api&utm_source=4a3e4881&v=29E85F7F3FC611901C527BEB363DD8F9205909FF,2025-01-24 21:31:41
SENIOR DATA ANALYST,Just Digital People,"South Yarra, Stonnington Area",IT Jobs,,full_time,,,2025-01-23T21:15:29Z,"About Step into a pivotal role with one of Australia’s leading logistics companies, with 800 staff nationally and a fleet of over 3,000. As they embark on their data revolution, this is a chance to be a key player in shaping the future of their operations. You’ll have the opportunity to influence strategic decisions, and within 8-12 months, manage a small team, driving innovation and efficiency across the business. What You’ll Be Doing: Designing, developing, and maintaining impactful Power BI …",https://www.adzuna.com.au/land/ad/5020851958?se=tt9VNDza7xGongxyKn7jYQ&utm_medium=api&utm_source=4a3e4881&v=6C11BE822DC8A1654649DAEE30DF02DF6EB9D026,2025-01-24 21:31:41
Portfolio Data Analyst,Macquarie,"The Rocks, Sydney",Accounting & Finance Jobs,,full_time,,,2025-01-17T10:55:47Z,"Join our dynamic Commodities and Global Markets team at Macquarie, where we leverage our expertise to provide comprehensive solutions across a diverse range of commodities and financial markets. Our Central Change and Project Management team is responsible for the governance and management of Commodities and Global Market’s change portfolio and the delivery of various cross-divisional projects. At Macquarie, our advantage is bringing together diverse people and empowering them to shape all kind…",https://www.adzuna.com.au/land/ad/5013599890?se=tt9VNDza7xGongxyKn7jYQ&utm_medium=api&utm_source=4a3e4881&v=0E8501E6CB7E0A910619109D9697A77D832CDC59,2025-01-24 21:31:41
Data Analyst - Retail Analytics,ANZ,"South Yarra, Stonnington Area",IT Jobs,,full_time,,,2025-01-17T11:11:23Z,"About Us At ANZ, we're applying new ways technology and data can be harnessed as we work towards a common goal: to improve the financial wellbeing and sustainability of our millions of customers. About the Role As a Data Analyst in Retail Analytics, you’ll play a key role in helping the ANZ deposits business run smoothly by providing high quality, fit for purpose and insightful data solutions and reports. This role is responsible for collecting, cleansing, optimizing & interrogating data to gen…",https://www.adzuna.com.au/land/ad/5013682294?se=tt9VNDza7xGongxyKn7jYQ&utm_medium=api&utm_source=4a3e4881&v=334FB1B759732F32E1D150031F0CF48CBAF95930,2025-01-24 21:31:41
Lead Business Data Analyst,Real Time,"The Rocks, Sydney",IT Jobs,contract,full_time,,,2025-01-22T09:14:08Z,"Advanced Data Technical Skills: SQL, data visualisation tools, R OR Python,  Join experimental & innovative data analytics team Go To Market - Business Insights, Customer Insights Role: Lead Business Data Analyst Location: Sydney 2000 - WFH/WFO Type: Contract Daily or Maximum Term Contract Daily Rate: $992/day including superannuation Max Term Contract Salary: $220k including superannuation Duration: Initial 12 month contract, potential to extend or permanent conversion This role is not just ab…",https://www.adzuna.com.au/land/ad/5018860388?se=tt9VNDza7xGongxyKn7jYQ&utm_medium=api&utm_source=4a3e4881&v=37EEC51679EDA778DA82CAF34427F7ADE8B62EBF,2025-01-24 21:31:41
Senior Technical Data Analyst,Urban Utilities,"Fortitude Valley, Brisbane",IT Jobs,permanent,full_time,,,2025-01-17T11:10:36Z,"Permanent Full Time, 38hr week $60.24/hr base  super (up to 14%)  leave loading Location: Fortitude Valley with hybrid and flexible working arrangements There’s No Us Without U. Care with Us, for Today and Tomorrow There's no life without water, and at Urban Utilities, we live and breathe that knowledge every single day. It's why our people are so passionate about what they do and how they do it. And it's why we need people like YOU . Come shape our future with us and make a real and lasting im…",https://www.adzuna.com.au/land/ad/5013676118?se=tt9VNDza7xGongxyKn7jYQ&utm_medium=api&utm_source=4a3e4881&v=D3974CD6C1F6B4C510131B6134D9D3A1BF317C20,2025-01-24 21:31:41
Spatial Data Analyst - Graduate Opportunity,EBR,"The Rocks, Sydney",Graduate Jobs,,full_time,,,2025-01-17T10:49:20Z,"Spatial Data Analyst About the role You will be undertaking the acquisition, analysis, interpretation, manipulation, and dissemination of vehicle, driver shift, spatial and other bus service data to support network systems and public transport customer information products. Your Responsibilities Ensure quality and integrity of customer data Use computer-based planning, scheduling and statistical tools to report on service performance, customer feedback and demographic trends Service planning, t…",https://www.adzuna.com.au/land/ad/5013564271?se=tt9VNDza7xGongxyKn7jYQ&utm_medium=api&utm_source=4a3e4881&v=E58CBE469CDA36F8661AD5B982B3DF9AFFBD44D5,2025-01-24 21:31:41
Senior GIS Data Analyst,EBR,"The Rocks, Sydney",IT Jobs,,full_time,,,2025-01-17T10:49:18Z,"We are looking for Talented Superstars who can start ASAP If you are an A Player, then hit APPLY Now Our client is seeking a passionate individual with expertise in the spatial data field. The successful applicant will carry out Senior GIS Data Analyst duties and provide specialist expertise, advice and services to ensure the relevant spatial data are sourced, managed and accessible. Key Requirements: To provide specialist expertise for integration and high-end manipulation and analysis of spat…",https://www.adzuna.com.au/land/ad/5013563832?se=tt9VNDza7xGongxyKn7jYQ&utm_medium=api&utm_source=4a3e4881&v=6B238309F328666248EEE487A17D8F105A379F77,2025-01-24 21:31:41
Senior Data Analyst (358026),Department of Justice,"Rosny, Clarence Area",Consultancy Jobs,contract,full_time,,,2025-01-17T11:10:29Z,"We encourage applications from Indigenous Australians, people living with disability, people from diverse cultural and linguistic backgrounds, mature age workers and LGBTIQA people. The Department of Justice supports reasonable adjustment requests in any stage of the assessment process to remove barriers and facilitate full participation in all aspects of employment for applicants with disability. If you have individual requirements that need to be accommodated in order to participate in an int…",https://www.adzuna.com.au/land/ad/5013675220?se=tt9VNDza7xGongxyKn7jYQ&utm_medium=api&utm_source=4a3e4881&v=79ADEBF59BF76007A508FD985B4F39DFAB5C006A,2025-01-24 21:31:41
SAP Master Data Analyst,Opal,"South Yarra, Stonnington Area",Retail Jobs,,full_time,,,2025-01-17T11:02:25Z,"Discover Opal…. We manufacture goods that you see, touch, and use every day and our customer base includes some of the biggest names in FMCG, Retail and Fresh Produce. We stand for innovation, smart solutions, and sustainability Discover What We Can Offer You…. Stability and long-term career path with Opal Flexible work from home and office mix, and good flexibility around hours Work with a team of subject matter experts, expanding and growing your SAP Master Data knowledge Discover the Opportu…",https://www.adzuna.com.au/land/ad/5013640140?se=tt9VNDza7xGongxyKn7jYQ&utm_medium=api&utm_source=4a3e4881&v=60F16F84728B8526A4C71E1830D82D6461F53A9E,2025-01-24 21:31:41
