Title,Company,Location,Category,Contract Type,Contract Time,Salary Min,Salary Max,Created,Description,Redirect URL,timestamp
Principal Project Officer - Data Analyst (Health Economics),Queensland Government,"Brisbane, Brisbane Region",Consultancy Jobs,,full_time,,,2025-01-15T11:24:02Z,"The role The purpose of the Principal Project Officer role is to support ORI in leading the development, implementation, regulation and evaluation of the Genomics Program in alignment with the Queensland Health Genomics and Precision Medicine Strategic Roadmap 2021-2026. Key responsibilities:  Undertake rigorous systematic evidence assessments, analyse complex data and statistics and use findings to provide cost- effectiveness, risks, issues, and future opportunities advice to Health Services E…",https://www.adzuna.com.au/details/5010702318?utm_medium=api&utm_source=4a3e4881,2025-01-24 21:31:41
VP of Product,Pet Circle,"The Rocks, Sydney",Retail Jobs,,full_time,,,2025-01-17T10:51:52Z,"Dogs, cats, budgies and everything in between - pets deserve the world. They make us want to be better humans. That’s why we’ve made it our mission to build the most engaged and passionate community of pets and pet parents across the world. And we’re looking for talented team mates who can help us do it. Founded in Sydney, our team of 500 pet obsessives span Australia, New Zealand and the Philippines. We’ve scaled to become one of Australia's top five eCommerce companies and the no.1 online pet…",https://www.adzuna.com.au/land/ad/5013577719?se=fLDPRjza7xGcnIQWkeNlkQ&utm_medium=api&utm_source=4a3e4881&v=6E78B7A6B2BD14BB1F3BAB945AC12F92069312A3,2025-01-24 21:31:41
Data Governance Analyst,AIA Australia Limited,Australia,IT Jobs,,full_time,,,2025-01-17T21:53:31Z,"The Data Governance Analyst will be working across different data domains, and be responsible for ensuring the integrity, consistency, and security of the organization’s data assets. ​ The opportunity: We have a newly created role within the Data Governance team. The Data Governance Analyst will be working across different data domains, and be responsible for ensuring the integrity, consistency, and security of the organization’s data assets. To do this successfully you will: Have a strong unde…",https://www.adzuna.com.au/details/5014218218?utm_medium=api&utm_source=4a3e4881,2025-01-24 21:31:41
Data Validation Analyst,Victorian Government,"Loddon Area, Bendigo Region",IT Jobs,permanent,full_time,,,2025-01-17T16:44:19Z,"About us The Portable Long Service Authority (the Authority) is a self-funded statutory body established to administer the Long Service Benefits Portability Act 2018. The Act, together with the Long Service Benefits Portability Regulations 2020 provide a Portable Long Service Benefits Scheme. The Authority plays an important role in allowing workers in the community services, contract cleaning and security industries to build up long service benefits based on time in their industry rather than …",https://www.adzuna.com.au/details/5013862569?utm_medium=api&utm_source=4a3e4881,2025-01-24 21:31:41
Data Analytics Analyst,IQVIA,"North Sydney, North Sydney Area",IT Jobs,,,,,2025-01-21T12:25:32Z,"IQVIA is currently recruiting for a Data Analytics Analyst. Location: Hybrid - Sydney NSW Type: Permanent full time This position involves gathering, verifying, and analyzing data to create reports and databases that meet client needs. It includes providing insights and interpretations of data outcomes, conducting technical analyses to address client queries, and maintaining data integrity. The position also focuses on investigating data anomalies, identifying trends, managing report requests, …",https://www.adzuna.com.au/details/5017995987?utm_medium=api&utm_source=4a3e4881,2025-01-24 21:31:41
Data Migration Analyst,RLDatix,"Middle Park, Port Phillip",IT Jobs,,full_time,,,2025-01-24T03:38:31Z,"RLDatix is on a mission to transform care delivery worldwide, ensuring every patient receives the safest, highest-quality care. Through our innovative Healthcare Operations Platform, we're connecting data to unlock trusted insights that enable improved decision-making and help deliver safer healthcare for all. At RLDatix we’re making healthcare safer, together. Our shared passion for meaningful work drives us, while a supportive, respectful culture makes it all possible. As a team, we collabora…",https://www.adzuna.com.au/details/5021144984?utm_medium=api&utm_source=4a3e4881,2025-01-24 21:31:41
Data Quality Analyst,REA Group,"Sydney, Sydney Region",IT Jobs,,,,,2025-01-14T12:23:22Z,"REA Group (https://www.rea-group.com/about-us/about-rea-group/) is not your average digital business. From humble beginnings in a garage in Melbourne's east in 1995, we have grown into a leading global digital business, specialising in property. With bold and ambitious goals, we are changing the way the world experiences property. No matter where you're at on your property journey, we're here to help with every step - whether that's finding or financing your next home. Our people are the key to…",https://www.adzuna.com.au/details/5009418765?utm_medium=api&utm_source=4a3e4881,2025-01-24 21:31:41
Data Quality Analyst,REA Group,"Melbourne, Melbourne Region",IT Jobs,,,,,2025-01-14T12:23:22Z,"REA Group (https://www.rea-group.com/about-us/about-rea-group/) is not your average digital business. From humble beginnings in a garage in Melbourne's east in 1995, we have grown into a leading global digital business, specialising in property. With bold and ambitious goals, we are changing the way the world experiences property. No matter where you're at on your property journey, we're here to help with every step - whether that's finding or financing your next home. Our people are the key to…",https://www.adzuna.com.au/details/5009418766?utm_medium=api&utm_source=4a3e4881,2025-01-24 21:31:41
Data Quality Analyst,REA Group,"Brisbane, Brisbane Region",IT Jobs,,,,,2025-01-14T12:23:21Z,"REA Group (https://www.rea-group.com/about-us/about-rea-group/) is not your average digital business. From humble beginnings in a garage in Melbourne's east in 1995, we have grown into a leading global digital business, specialising in property. With bold and ambitious goals, we are changing the way the world experiences property. No matter where you're at on your property journey, we're here to help with every step - whether that's finding or financing your next home. Our people are the key to…",https://www.adzuna.com.au/details/5009418764?utm_medium=api&utm_source=4a3e4881,2025-01-24 21:31:41
Data Quality Analyst,realestate.com.au Pty,"Richmond, Yarra Area",IT Jobs,,full_time,,,2025-01-14T21:47:18Z,"REA Group is not your average digital business. From humble beginnings in a garage in Melbourne’s east in 1995, we have grown into a leading global digital business, specialising in property. With bold and ambitious goals, we are changing the way the world experiences property. No matter where you're at on your property journey, we're here to help with every step – whether that's finding or financing your next home. Our people are the key to our success. At the heart of everything we do, is a t…",https://www.adzuna.com.au/details/5009853101?utm_medium=api&utm_source=4a3e4881,2025-01-24 21:31:41
"Senior Data Governance Analyst / $150,000  super  5% bonus",Allura Partners,"The Rocks, Sydney",IT Jobs,permanent,full_time,,,2025-01-17T11:02:02Z,"Data Governance Permanent Data Senior Data Governance Analyst / Sydney or Melbourne / Permanent / $150,000  super  5% bonus About the Company ASX listed Insurance company with offices across Sydney and Melbourne, looking to expand their Data Governance team going into the new year. About the Role They're looking for a Senior Data Governance Analyst to drive data governance and ensure high data quality across the business. You’ll collaborate with data teams to develop policies, enhance complianc…",https://www.adzuna.com.au/land/ad/5013638255?se=fLDPRjza7xGcnIQWkeNlkQ&utm_medium=api&utm_source=4a3e4881&v=26AB3A5D8396A3BBF0D7A6DDBAA71F06476F2A1F,2025-01-24 21:31:41
Senior Data Engineer,Optus,"Macquarie Park, Ryde Area",IT Jobs,,full_time,,,2025-01-17T11:09:55Z,"Senior Data Engineer It starts with YES At Optus, we are fuelled by optimism, unwavering customer focus, and a team of amazing people. And that’s where we come in…. “the amazing people” part We don’t sit back and wait for the future to happen, we are out there crafting our own path through new technology, innovation, and investment. We are truly a challenger brand, with challenger spirit. As our new Senior Data Engineer, you’ll be at the forefront of designing, building, and maintaining both ba…",https://www.adzuna.com.au/land/ad/5013672126?se=fLDPRjza7xGcnIQWkeNlkQ&utm_medium=api&utm_source=4a3e4881&v=5881DCC685B46D649C7AF589666A2C74897BF857,2025-01-24 21:31:41
Data Engineer,Optus,"Macquarie Park, Ryde Area",IT Jobs,,full_time,,,2025-01-17T11:09:55Z,"​​​​​ Data Engineer It starts with YES At Optus, we are fuelled by optimism, unwavering customer focus, and a team of amazing people. And that’s where we come in…. “the amazing people” part We don’t sit back and wait for the future to happen, we are out there crafting our own path through new technology, innovation, and investment. We are truly a challenger brand, with challenger spirit. As our new Data Engineer, you’ll be at the forefront of designing, building, and maintaining both batch and …",https://www.adzuna.com.au/land/ad/5013672125?se=fLDPRjza7xGcnIQWkeNlkQ&utm_medium=api&utm_source=4a3e4881&v=F3CA6EC31121AF90994114B2DE35BD3A767308E0,2025-01-24 21:31:41
Data Risk and Governance Analyst,Macquarie,"The Rocks, Sydney",Accounting & Finance Jobs,,full_time,,,2025-01-17T10:52:29Z,"The Commodities and Global Markets Data Management team is a diverse group of high performing individuals, striving to improve the governance and controllership over data. At Macquarie, our advantage is bringing together diverse people and empowering them to shape all kinds of possibilities. We are a global financial services group operating in 34 markets and with 55 years of unbroken profitability. You’ll be part of a friendly and supportive team where everyone - no matter what role - contribu…",https://www.adzuna.com.au/land/ad/5013580898?se=fLDPRjza7xGcnIQWkeNlkQ&utm_medium=api&utm_source=4a3e4881&v=8470CEC93730D0C0BAD4B1CCFF92A235ABC1983C,2025-01-24 21:31:41
Senior Data Scientist,Correlate Resources,"The Rocks, Sydney","PR, Advertising & Marketing Jobs",,full_time,,,2025-01-17T10:50:50Z,"Correlate Resources: Your trusted Data Analytics Recruitment Partner. Apply Now for exclusive opportunities, market insights & ongoing career coaching CAMPAIGN ANALYTICS SMEs - Build/Execute, ROI Optimisation CUTTING EDGE TECHNOLOGY - Salesforce Marketing Cloud, ExactTarget, Strong SQL CAREER DEVELOPMENT - Massive scope for career development, promotions and growth Our client is an industry pioneering Customer Data Science consultancy, who are disrupting the Australian market through the delive…",https://www.adzuna.com.au/land/ad/5013573298?se=fLDPRjza7xGcnIQWkeNlkQ&utm_medium=api&utm_source=4a3e4881&v=914ED0F029F337B34DF3F2792F124058594C2502,2025-01-24 21:31:41
Technical Business Analyst | Data and Digital Products,Macquarie,"The Rocks, Sydney",Accounting & Finance Jobs,,full_time,,,2025-01-17T11:08:49Z,"Join our Data and Digital product team within the Risk Management Group where you will work with data, reporting, automation, and Gen AI tools to support ongoing technology transformation across risk management. At Macquarie, our advantage is bringing together diverse people and empowering them to shape all kinds of possibilities. We are a global financial services group operating in 34 markets and with 55 years of unbroken profitability. You’ll be part of a friendly and supportive team where e…",https://www.adzuna.com.au/land/ad/5013667587?se=fLDPRjza7xGcnIQWkeNlkQ&utm_medium=api&utm_source=4a3e4881&v=F3EE7A646C0AE7C92EB2EBA6CC239D540BA0A62B,2025-01-24 21:31:41
Business / Data Analyst - Time & Attendance System Implementation - 12M CONTRACT,Northbridge IT Recruitment Propr,"The Hills District, Sydney Region",IT Jobs,contract,full_time,270000,270000,2025-01-23T06:28:46Z,"THIS IS IT : Join a dynamic, well-established, and growing customer centric company with a Large Scale Global Transformation Program underway. This Industry leader offers an empowering an innovative company culture. We have (12 Month Contract) Business Data Analyst role available. This will see you working on a Large-Scale Rostering System Replacement Program to Implement Workforce Software (WFS). This is a Business side role with a focus on Business utilisation and 'Time & Attendance System / …",https://www.adzuna.com.au/details/5020125251?utm_medium=api&utm_source=4a3e4881,2025-01-24 21:31:41
Lead Data Scientist,Talent Insights,"The Rocks, Sydney",IT Jobs,permanent,full_time,,,2025-01-17T11:08:09Z,"Role: Senior/Lead Data Scientist Location: Sydney (Hybrid Work) Position Type: Full-Time, Permanent Salary: $160,000-180,000 base  super Are you passionate about the latest advancements in machine learning, predictive analytics and AI? If so, this is the perfect opportunity to join an innovative team and shape the future of their projects About the role: This is an exciting opportunity for a senior/lead data scientist to join a leading insurer based in Sydney. This role gives you the opportunit…",https://www.adzuna.com.au/land/ad/5013664748?se=fLDPRjza7xGcnIQWkeNlkQ&utm_medium=api&utm_source=4a3e4881&v=7E20DAC215835178EB9059EDC5A9FF57C9D54541,2025-01-24 21:31:41
Technical Data Business Analyst,FourQuarters,"Sydney, Sydney Region",IT Jobs,permanent,full_time,140000,150000,2024-12-29T22:54:24Z,My client is a market leading organisation who are looking for a Business Analyst with strong Business Data experience to support a large scale transformation. They require someone who has most of the following skills / experience: A BA who sits within the business and has a good understanding of the data Understand big data and big company data Some modelling & understanding of the Azure environment SQL Understanding the Tech but need the business side to know the implications and make recomme…,https://www.adzuna.com.au/details/4991633035?utm_medium=api&utm_source=4a3e4881,2025-01-24 21:31:41
Data Business Analyst - banking,Talenza,"Sydney, Sydney Region",IT Jobs,permanent,full_time,13000,14000,2025-01-24T03:50:50Z,"Talenza has been engaged to source two Business Analysts to join a data program in permament positions. Required experience: Minimum 4 years in a Business Analyst role Prior banking experience as a Business Analyst (essential) Prior experience working on a data program would be highly beneficial Prior agile program experience including writing user stories and acceptance criteria Basic SQL experience Prior systems integration experience, including APIs would be highly beneficial Prior data migr…",https://www.adzuna.com.au/details/5021172994?utm_medium=api&utm_source=4a3e4881,2025-01-24 21:31:41
Senior Customer Retention Insights Analyst,Luxury Escapes,"Southbank, Melbourne",IT Jobs,,full_time,,,2025-01-17T11:02:26Z,"Luxury Escapes is one of the world's fastest growing travel businesses, reaching up to 7 million subscribers each month with exclusive limited time offers at 'insider' prices. Here at Luxury Escapes, our mission is to delight our customers with incredible deals for the world's best holidays. We are a collective of forward-thinking people, driven to challenge the travel industry and ourselves to bring ever better travel experiences to our customer community. Our award winning employee experience…",https://www.adzuna.com.au/land/ad/5013640208?se=4Du-Sjza7xGongxyKn7jYQ&utm_medium=api&utm_source=4a3e4881&v=4D91E8AFD3174823AB219C10D467F2CBBD8A36AE,2025-01-24 21:31:41
Chapter Lead RBS Data Advanced Analytics,Commonwealth Bank of Australia,"Sydney CBD, Sydney",Consultancy Jobs,,full_time,,,2025-01-18T11:05:09Z,"You are a curious and enthusiastic leader with a true passion for mentoring data analysts and being an advocate for your team’s work We are a values-driven team of analytical techsperts, who believe in the power of proof, supporting growth and getting excited over data storytelling Together we can harness the power of data, analytics, and technology to identify solutions for our customers and communities to improve their financial wellbeing and really make a difference. Your responsibilities wi…",https://www.adzuna.com.au/land/ad/5015086753?se=4Du-Sjza7xGongxyKn7jYQ&utm_medium=api&utm_source=4a3e4881&v=4A5D81EE8EF3B1E4A35EDE1547D0C12F193ECF10,2025-01-24 21:31:41
Junior Associate - Data & Analytics,Orizontas,"South Yarra, Stonnington Area",Consultancy Jobs,,full_time,,,2025-01-17T10:57:31Z,"About Us : Orizontas is a boutique corporate advisory consultancy that solves business challenges through strategic advice and deep expertise in political, market, reputational and climate risk. About You : Candidate experience for the position includes: Five or more years of experience working in the data and analytics field, preferably with a related degree in the field; Demonstrated experience in the environment, sustainability, and climate change industry, preferably with a related degree i…",https://www.adzuna.com.au/land/ad/5013610184?se=4Du-Sjza7xGongxyKn7jYQ&utm_medium=api&utm_source=4a3e4881&v=F7E3E28B777980DCD65EA32BB820E43D78F2EFCB,2025-01-24 21:31:41
Pricing Analyst,Travelex,"The Rocks, Sydney",Accounting & Finance Jobs,,full_time,,,2025-01-17T10:58:24Z,"Role purpose The Pricing Analyst plays a crucial role at Travelex by ensuring the accuracy and efficiency of our pricing strategies across the ANZ and Asia regions. This position is pivotal in driving profitability and competitiveness through meticulous rate setting, margin management, and rate distribution. As a Pricing Analyst, you will: Lead Pricing Initiatives: Take charge of managing and maintaining dynamic pricing processes, ensuring maximum uptime and accuracy. Collaborate Globally: Work…",https://www.adzuna.com.au/land/ad/5013617409?se=4Du-Sjza7xGongxyKn7jYQ&utm_medium=api&utm_source=4a3e4881&v=6B241702761E4C864338C061F5EA3A5FE78F531B,2025-01-24 21:31:41
Senior Data System Analyst,Job Details,Australia,IT Jobs,permanent,full_time,,,2025-01-15T21:49:59Z,"Senior Data System Analyst Job No: 673572 Sydney - Inner Suburbs & CBD, Brisbane - Inner Suburbs & CBD, Melbourne - Inner Suburbs & CBD, Various Permanent Full Time IT Pay Band 5 Hybrid Working Environment QLD location ideally, open to NSW or VIC We’re never just satisfied with how things are – because we know how things could be. And it’s our expert Technology team who forge ahead every day to make those ‘what ifs’ a reality. As a Senior Data System Analyst, you will play a crucial role as the…",https://www.adzuna.com.au/details/5011312561?utm_medium=api&utm_source=4a3e4881,2025-01-24 21:31:41
Senior Data System Analyst,Suncorp Group,"Sydney Region, New South Wales",IT Jobs,permanent,full_time,,,2025-01-14T19:17:26Z,"Hybrid Working Environment QLD location ideally, open to NSW or VIC We’re never just satisfied with how things are – because we know how things could be. And it’s our expert Technology team who forge ahead every day to make those ‘what ifs’ a reality. As a Senior Data System Analyst, you will play a crucial role as the liaison between business requirements and technical data solutions, with a primary focus on optimizing data-related aspects within our organisation. We are requiring a new Senior…",https://www.adzuna.com.au/details/5009757678?utm_medium=api&utm_source=4a3e4881,2025-01-24 21:31:41
People Data Quality Analyst,University of New South Wales,"Sydney, Sydney Region",IT Jobs,,,,,2025-01-18T11:16:58Z,"People Data Quality Analyst Employment Type: Full Time (35 hours per week) Duration: 12-month Contract Remuneration: Level 7 $110,073 - $119,132 (depending on experience)  17% super  leave loading Location: Kensington, NSW (hybrid) Join UNSW as a Data Quality Analyst and ensure the accuracy, consistency, and integrity of our data. Work with key teams across People & Culture and HR Solutions to resolve inconsistencies and uphold high data standards, empowering smarter, data-driven decision-makin…",https://www.adzuna.com.au/details/5015108015?utm_medium=api&utm_source=4a3e4881,2025-01-24 21:31:41
Senior Data System Analyst,Job Details,Australia,IT Jobs,permanent,full_time,,,2025-01-15T21:49:54Z,"Senior Data System Analyst Job No: 673625 Sydney - Inner Suburbs & CBD, Brisbane - Inner Suburbs & CBD, Melbourne - Inner Suburbs & CBD, Various Permanent Full Time IT Pay Band 5 Flexible working Locations Hybrid Working Environment (WFH) Bridge the gap between business needs and technical solutions We’re never just satisfied with how things are – because we know how things could be. And it’s our expert Technology team who forge ahead every day to make those ‘what ifs’ a reality. Welcome to a p…",https://www.adzuna.com.au/details/5011312514?utm_medium=api&utm_source=4a3e4881,2025-01-24 21:31:41
Senior Data System Analyst,Suncorp Group,"Sydney Region, New South Wales",IT Jobs,permanent,full_time,,,2025-01-15T19:17:15Z,"Flexible working Locations Hybrid Working Environment (WFH) Bridge the gap between business needs and technical solutions We’re never just satisfied with how things are – because we know how things could be. And it’s our expert Technology team who forge ahead every day to make those ‘what ifs’ a reality. Welcome to a place where you can chase real progress and drive real change. And that includes your own career. Being a part of Technology at Suncorp Group means being switched on, endlessly cur…",https://www.adzuna.com.au/details/5011264519?utm_medium=api&utm_source=4a3e4881,2025-01-24 21:31:41
Senior Data Insight Analyst,Steadfast HRIS,"Sydney, Sydney Region",IT Jobs,permanent,full_time,,,2025-01-15T21:49:57Z,"Introduction About the job Steadfast Group is the largest general insurance broker network and the largest underwriting agency group in Australasia with growing operations internationally. We were founded on the belief that a network of brokers would be stronger together, and this idea has been the backbone of our culture ever since. We believe that none of us is as good as all of us. At Steadfast, we take pride in the diverse mix of individuals and skill sets within our organisation. Our team …",https://www.adzuna.com.au/details/5011312543?utm_medium=api&utm_source=4a3e4881,2025-01-24 21:31:41
Intern Data Enablement Analyst,Helia,"Sydney, Sydney Region",IT Jobs,contract,full_time,,,2025-01-20T21:49:15Z,"Helia, as Australia’s first Lenders Mortgage Insurance (LMI) provider, with over 50 years expertise in the Australian housing market are in the process of re-inventing ourselves. We exist to accelerate financial wellbeing through home ownership, now and for the future. Our mission is to create innovative and tailored solutions in partnership with our customers. We aim to do this efficiently and conveniently, leveraging state of the art technology and data solutions. The Intern Data Enablement A…",https://www.adzuna.com.au/details/5017317441?utm_medium=api&utm_source=4a3e4881,2025-01-24 21:31:41
"Data and Insights Analyst Sydney, Australia Full-time",OFX,"The Rocks, Sydney",IT Jobs,,full_time,,,2025-01-17T11:01:57Z,"Job Description Hi . We’re OFX, a global provider of online international payment and money management services. Our journey is one of exciting growth and transformation, revolutionizing how businesses and individuals move and manage money globally. We're evolving into a global payment solutions provider, enabling businesses to streamline their global financial operations, improve control, reduce costs and achieve more. Our new Business Platform offers clients real-time visibility and controls …",https://www.adzuna.com.au/land/ad/5013637627?se=4Du-Sjza7xGongxyKn7jYQ&utm_medium=api&utm_source=4a3e4881&v=69C12D82E9F019E0C26607373915BB917B883F81,2025-01-24 21:31:41
Casual Crew - Sales and Food Preparation Roles - Augustine Heights,Guzman Y Gomez,"Augustine Heights, Ipswich",Hospitality & Catering Jobs,,,,,2025-01-17T10:55:15Z,"Company Description 150 restaurants across Australia, Singapore, Tokyo and the USA today, and opening 30-35 new restaurants every year - Guzman y Gomez (GYG) is the fastest growing food company in Australia and we’re changing the perception of fast food. Job Description Our Sales and Food Preparation Crew Members are the lifeblood of GYG. You are on the front line, greeting customers, taking orders, problem solving and weighing-in with expertise on custom food designs. Every day you’ll have the…",https://www.adzuna.com.au/land/ad/5013597124?se=4Du-Sjza7xGongxyKn7jYQ&utm_medium=api&utm_source=4a3e4881&v=4D41A9C059C9853D1E3D4A5779482B1BF57F0D8F,2025-01-24 21:31:41
"Staff Product Manager, Cash Management",Airwallex,"The Rocks, Sydney",Accounting & Finance Jobs,,full_time,,,2025-01-17T10:58:25Z,"About Airwallex Airwallex is the only unified payments and financial platform for global businesses. Powered by our unique combination of proprietary infrastructure and software, we empower over 100,000 businesses worldwide – including Brex, Rippling, Navan, Qantas, SHEIN and many more – with fully integrated solutions to manage everything from business accounts, payments, spend management and treasury, to embedded finance at a global scale. Proudly founded in Melbourne, we have a team of over …",https://www.adzuna.com.au/land/ad/5013617633?se=4Du-Sjza7xGongxyKn7jYQ&utm_medium=api&utm_source=4a3e4881&v=EA3FAD0B7DC8BEEED212CD56B073708C452AA314,2025-01-24 21:31:41
