Title,Company,Location,Category,Contract Type,Contract Time,Salary Min,Salary Max,Created,Description,Redirect URL,timestamp
Data Analyst,HorizonOne,"Canberra Region, Australian Capital Territory",IT Jobs,permanent,full_time,,,2024-12-31T04:18:53Z,"HorizonOne Recruitment is a specialist recruitment firm redefining traditional approaches. With a focus on quality, service, and deep subject-matter expertise, we prioritize candidates, tailoring our efforts to find the best possible fit. Our reverse-recruiting model puts you at the centre, coaching you through career planning and helping you navigate the market to uncover opportunities that align with your long-term goals. The Opportunity New year, new role, new opportunities. This is an expre…",https://www.adzuna.com.au/details/4992303780?utm_medium=api&utm_source=4a3e4881,2025-01-24 21:31:41
Data Analyst,Relationships Australia SA,"Adelaide, Adelaide Region",IT Jobs,contract,full_time,,,2024-12-26T20:58:27Z,"Full-time, 2-year Fixed Term Contract with possibility of renewal Competitive Annual Salary  Super  Salary Packaging  Located in Adelaide Join our dynamic team and make a difference Relationships Australia South Australia (RASA) is a dynamic community services organisation that delivers a broad range of programs and services. RASA is seeking a skilled Data Analyst to join our team and play a crucial role in driving data-driven decision-making. As a Data Analyst, you will leverage your expertise…",https://www.adzuna.com.au/details/4989684155?utm_medium=api&utm_source=4a3e4881,2025-01-24 21:31:41
Data Analyst,Victorian Government,"Melbourne CBD, Melbourne",Scientific & QA Jobs,contract,full_time,,,2024-12-27T16:36:23Z,"Here in Early Childhood Education, Department of Education, we have an opportunity for a Data Analyst within Sector Monitoring. If you are looking to further develop your demonstrated data analysis skills whilst gaining broader project experience, enjoy a challenge and thrive in a supportive team environment, please apply to join us. About the Department The role of the Department of Education is to support Victorians to build prosperous, socially engaged, happy and healthy lives. It does this …",https://www.adzuna.com.au/details/4990116927?utm_medium=api&utm_source=4a3e4881,2025-01-24 21:31:41
Data Analyst,Eightcap Pty Ltd,"Melbourne CBD, Melbourne",IT Jobs,,full_time,,,2025-01-20T21:49:36Z,"As a Data Analyst on the Data Team, you will play a crucial role in analysing, interpreting, and reporting on data to our Data management and trading operations. Your insights will be instrumental in ensuring the accuracy, efficiency, and effectiveness of our risk management processes. Key Responsibilities: Analyse and interpret complex datasets to identify trends, patterns, and potential risks. Develop, maintain and showcase risk management reports and dashboards for internal and external stak…",https://www.adzuna.com.au/details/5017320223?utm_medium=api&utm_source=4a3e4881,2025-01-24 21:31:41
Data Analyst,DEAKIN UNIVERSITY,Australia,IT Jobs,,full_time,,,2025-01-11T21:46:41Z,"We are looking for a Data Analyst to join our People Systems and Reporting team This role is key in delivering high-quality workforce data to both internal and external stakeholders, including supporting annual statutory reporting. The ideal candidate will have strong technical skills in enterprise reporting and business intelligence tools (PeopleSoft, PageUp, IBM Cognos11) to ensure efficient data access and drive continuous improvement. If you have a passion for data, we’d love to hear from y…",https://www.adzuna.com.au/details/5006781950?utm_medium=api&utm_source=4a3e4881,2025-01-24 21:31:41
Data Analyst,FNZ Group,"Middle Park, Port Phillip",Accounting & Finance Jobs,permanent,part_time,,,2025-01-03T13:11:27Z,"Data Analyst Reporting to the Senior Manager of the Data Quality and Reporting team, this role offers an exciting opportunity for a seasoned, detail -orientated Data Analyst with expertise in the superannuation and financial services. You will play a crucial role in providing data insights as well as supporting the Fund Accounting function by ensure data quality, accuracy and consistency in our data collections, processing, and reporting activities. The Fund Accounting team comprises skilled Ac…",https://www.adzuna.com.au/details/4995996474?utm_medium=api&utm_source=4a3e4881,2025-01-24 21:31:41
Data Analyst,APS,Australia,IT Jobs,,full_time,97735,97735,2025-01-24T17:34:34Z,"DVA has an insatiable appetite for data and associated insights. From ad-hoc requests for specific information to inform reporting and policy development, to cutting edge modelling to predict future trends, volume, costs, and program efficacy - data is increasingly central to everything we do. The purpose of the Data and Insights Branch is to evolve the way the department produces and uses data, analytics and research, to underpin evidence-based policy development, service delivery and wellbein…",https://www.adzuna.com.au/details/5021943689?utm_medium=api&utm_source=4a3e4881,2025-01-24 21:31:41
Data Analyst,FNZ,"Melbourne, Melbourne Region",Accounting & Finance Jobs,,full_time,,,2024-12-25T21:02:16Z,"Reporting to the Senior Manager of the Data Quality and Reporting team, this role offers an exciting opportunity for a seasoned, detail -orientated Data Analyst with expertise in the superannuation and financial services. You will play a crucial role in providing data insights as well as supporting the Fund Accounting function by ensure data quality, accuracy and consistency in our data collections, processing, and reporting activities. The Fund Accounting team comprises skilled Accountants and…",https://www.adzuna.com.au/details/4989148680?utm_medium=api&utm_source=4a3e4881,2025-01-24 21:31:41
Data Analyst,Westpac Banking Corporation,"Sydney, Sydney Region",IT Jobs,contract,full_time,,,2025-01-20T21:52:45Z,"Description Data Analyst (2x) Fixed Term / Secondment role (until 30 September 2025) Sydney (2 days in the office) Strong data analytics skills and experience required How will I help? In this role as a Data Analyst, your primary goal is to help the teams within Group Operations (GO) at Westpac best utilise and understand their data. You will be accountable for the design, build and implementation of operational reporting, analytics and tactical solutions that support operational excellence and…",https://www.adzuna.com.au/details/5017328778?utm_medium=api&utm_source=4a3e4881,2025-01-24 21:31:41
Data Analyst,Easy Authoring,"Parramatta, Parramatta Area",IT Jobs,,full_time,,,2025-01-07T03:46:51Z,"Join a large government department and contribute to meaningful data analysis with Power BI and advanced reporting tools. Contract until 20th April 2025, with possible extension. Competitive pay: $890 / day  super Full-time role: 40 hours per week, with flexible working options (3 days onsite, 2 days WFH) Office location: Parramatta Purpose of the Role: We’re seeking a Data Analyst with Fleet Management or Asset Management experience to design, develop, implement and support Business Intelligen…",https://www.adzuna.com.au/details/4999828139?utm_medium=api&utm_source=4a3e4881,2025-01-24 21:31:41
Data Analyst,The University of Melbourne,"Melbourne, Melbourne Region",IT Jobs,,full_time,,,2025-01-22T17:39:08Z,"Position Number: 0059724 Location: Parkville Role type: Full-time; Continuing Department: Enterprise Performance Group; Chief Operating Officer Portfolio Salary: UOM 7 – $106,432 – $115,211 p.a. plus 17% super Provide data insights and visualisations to support University decision-making and solve business challenges. Independently manage impactful projects using advanced tools like AWS, SQL, and Python. Brilliant benefits and a flexible hybrid work environment About the Role The Data Analyst d…",https://www.adzuna.com.au/details/5019126078?utm_medium=api&utm_source=4a3e4881,2025-01-24 21:31:41
Data Analyst,VALD,"Brisbane, Brisbane Region",IT Jobs,,,,,2025-01-10T12:21:20Z,"VALD is the world leader in technology for the allied health industry, providing innovative human-measurement technology to 6,500 clients in over 100 countries. If you have a favorite team in the NBA, EPL, or NFL, there's a good chance they use VALD Technologies. Since its humble beginnings in 2015 in Brisbane, Australia, VALD has grown to a team of over 200 team members in over 30 countries, with 5 offices across four continents. Driven by a multidisciplinary team of researchers, clinicians, s…",https://www.adzuna.com.au/details/5004338812?utm_medium=api&utm_source=4a3e4881,2025-01-24 21:31:41
Data Analyst,ISS Market Intelligence,"The Rocks, Sydney",Accounting & Finance Jobs,permanent,part_time,,,2025-01-03T13:11:32Z,"Let’s be BrilliantTogether Overview The Data Analyst is a valuable member of the Rainmaker Data Team, directly contributing to the company in the provision of data, insights, and market intelligence to the financial services industry in Australia. This position provides the opportunity to grow your data skills and experience on the financial services industry and products. The successful candidate will gain valuable experience in data collection, surveys, data entry, data auditing, data analysi…",https://www.adzuna.com.au/details/4995997389?utm_medium=api&utm_source=4a3e4881,2025-01-24 21:31:41
Data Analyst,ATTURRA OPERATIONS PTY LTD,"Brisbane, Brisbane Region",IT Jobs,permanent,full_time,140000,160000,2025-01-07T17:23:30Z,"Why is this an exciting opportunity? At Atturra, an Australian-owned ASX-listed advisory and IT solutions provider, we have a team of over 900 professionals working across Australia, New Zealand, Hong Kong and Singapore. Our diverse and dynamic team is united by our passion for innovation, using our expertise to leverage technology for business transformation. As part of our Cloud Business Solutions team, we have a strong partnership with Microsoft. This allows us to leverage their cutting-edge…",https://www.adzuna.com.au/details/5000454040?utm_medium=api&utm_source=4a3e4881,2025-01-24 21:31:41
Data Analyst,Clemenger Group,"Sydney, Sydney Region","PR, Advertising & Marketing Jobs",permanent,full_time,,,2025-01-20T16:45:48Z,"WE ARE LOOKING FOR THE NEW BREED OF ANALYST We're looking for someone with a baseline knowledge of analytics, marketing science or data science, but more importantly, we want someone who brings a passion for uncovering insights, a proactive attitude, and an eagerness to learn and grow. You're someone who's fascinated by human behavior and the why behind how marketing works. Data is the foundation of every business strategy, and we need someone who not only understands the numbers but can transf…",https://www.adzuna.com.au/details/5017165224?utm_medium=api&utm_source=4a3e4881,2025-01-24 21:31:41
Data Analyst,Expeditors,"Banyo, Brisbane",Logistics & Warehouse Jobs,,,,,2024-12-25T12:13:29Z,"Become a member of a global community International trade compliance is an integral piece of the global trade puzzle; we help to make the world go round. Our goal at Tradewin is to provide pragmatic compliance advice and minimise costs for our clients. At the heart of Tradewin you will find professionalism, leadership, and a friendly environment, all of which foster an innovative, customer service-based approach to international trade. Tradewin is a global firm headquartered in Seattle, Washing…",https://www.adzuna.com.au/details/4988747118?utm_medium=api&utm_source=4a3e4881,2025-01-24 21:31:41
Data Analyst,Queensland Government,"Brisbane, Brisbane Region",IT Jobs,permanent,full_time,,,2025-01-16T11:25:21Z,"The key responsibilitiesAccess, process, link, analyse and manage data using tools such as R, GitLab and customised data linkage software.Ensure outputs satisfy QGSO standards for integrity, governance, accuracy and timeliness.Contribute to the development and implementation of probabilistic data linkage and data management methodologies, tools and processes.Provide advice to clients, colleagues and other stakeholders on issues including those related to data quality, linkage and access.Develop…",https://www.adzuna.com.au/details/5012427938?utm_medium=api&utm_source=4a3e4881,2025-01-24 21:31:41
Data Analyst,MONEYME,"Sydney CBD, Sydney",Accounting & Finance Jobs,,,,,2025-01-18T11:04:35Z,"Acknowledgement of Country: MONEYME acknowledges Aboriginal and Torres Strait Islander peoples as the first people and Traditional Custodians of the land and waterways throughout Australia. We recognise their continued connection to culture, community and Country, and pay our respects to Elders past and present. View our journey towards reconciliation About MONEYME: MONEYME is a founder-led digital lender and Certified B Corporation ™. We challenge the traditional ways of credit and simplify th…",https://www.adzuna.com.au/details/5015082064?utm_medium=api&utm_source=4a3e4881,2025-01-24 21:31:41
Data Analyst,DataAnnotation,"Woolooware, Sutherland Area",Scientific & QA Jobs,permanent,part_time,,,2025-01-03T13:11:33Z,"We are looking for a mathematician with an advanced degree to join our team to train AI models. You will measure the progress of these AI chatbots, evaluate their logic, and solve problems to improve the quality of each model. In this role you will need to hold an expert level of mathematical reasoning- a completed or in progress Masters/PhD is preferred but not required. Other related fields include, but are not limited to: Applied Math and/or Computer Science. Benefits:This is a full-time or …",https://www.adzuna.com.au/details/4995997652?utm_medium=api&utm_source=4a3e4881,2025-01-24 21:31:41
Senior Data Enablement Analyst,Helia,"The Rocks, Sydney",IT Jobs,,full_time,,,2025-01-17T10:56:24Z,"Helia, as Australia’s first Lenders Mortgage Insurance (LMI) provider, with over 50 years expertise in the Australian housing market are in the process of re-inventing ourselves. We exist to accelerate financial wellbeing through home ownership, now and for the future. Our mission is to create innovative and tailored solutions in partnership with our customers. We aim to do this efficiently and conveniently, leveraging state of the art technology and data solutions. Role responsibilities The Se…",https://www.adzuna.com.au/land/ad/5013603407?se=1rRwPTza7xGcnIQWkeNlkQ&utm_medium=api&utm_source=4a3e4881&v=D41C84B701E5E17DE68FA83E9BD372D8169C82A1,2025-01-24 21:31:41
People Data Quality Analyst,University of New South Wales,"The Rocks, Sydney",IT Jobs,contract,full_time,,,2025-01-18T11:05:05Z,"People Data Quality Analyst Employment Type: Full Time (35 hours per week) Duration: 12-month Contract Remuneration: Level 7 $110,073 - $119,132 (depending on experience)  17% super  leave loading Location: Kensington, NSW (hybrid) Join UNSW as a Data Quality Analyst and ensure the accuracy, consistency, and integrity of our data. Work with key teams across People & Culture and HR Solutions to resolve inconsistencies and uphold high data standards, empowering smarter, data-driven decision-makin…",https://www.adzuna.com.au/land/ad/5015086156?se=1rRwPTza7xGcnIQWkeNlkQ&utm_medium=api&utm_source=4a3e4881&v=F4A8271EAA25F4771121B8070901BE789384C3FC,2025-01-24 21:31:41
Senior Data Solutions Analyst,ANZ,"The Rocks, Sydney",IT Jobs,permanent,full_time,,,2025-01-17T11:11:22Z,"About Us At ANZ, we're applying new ways technology and data can be harnessed as we work towards a common goal: to improve the financial wellbeing and sustainability of our millions of customers. About the Role The Markets Data team have a broad mandate for reducing operational friction and contributing to the growth objectives by leveraging emerging technologies within ANZ Markets. The team is focused on delivering and managing strategic end-to-end cloud-based data and analytics solutions, inc…",https://www.adzuna.com.au/land/ad/5013682141?se=ek-0Qjza7xGVJ3wCu-xnLw&utm_medium=api&utm_source=4a3e4881&v=CA68FEE6EF3A54B169E541B502CDFFC26EE0021A,2025-01-24 21:31:41
Data Platform Analyst | Capital,Macquarie,"The Rocks, Sydney",Accounting & Finance Jobs,,full_time,,,2025-01-17T10:50:44Z,"Join our Risk Reporting Analytics Platform team, in Capital Data Management. Our existing team of Data professionals within the Group Treasury division are focused on driving advanced data management capabilities to the growing importance of data as a strategic asset. At Macquarie, our advantage is bringing together diverse people and empowering them to shape all kinds of possibilities. We are a global financial services group operating in 34 markets and with 55 years of unbroken profitability.…",https://www.adzuna.com.au/land/ad/5013572671?se=ek-0Qjza7xGVJ3wCu-xnLw&utm_medium=api&utm_source=4a3e4881&v=90069A7D95AB89DC8F6D708B56648FBF9DCA1333,2025-01-24 21:31:41
Intern Data Enablement Analyst,Helia,"The Rocks, Sydney",IT Jobs,contract,full_time,,,2025-01-19T11:05:48Z,"Helia, as Australia’s first Lenders Mortgage Insurance (LMI) provider, with over 50 years expertise in the Australian housing market are in the process of re-inventing ourselves. We exist to accelerate financial wellbeing through home ownership, now and for the future. Our mission is to create innovative and tailored solutions in partnership with our customers. We aim to do this efficiently and conveniently, leveraging state of the art technology and data solutions. The Intern Data Enablement A…",https://www.adzuna.com.au/land/ad/5016235230?se=ek-0Qjza7xGVJ3wCu-xnLw&utm_medium=api&utm_source=4a3e4881&v=6C5552D5EC87F32A251E8A468D5B5334E4E58B93,2025-01-24 21:31:41
Senior Data Science Analyst,Medibank,"West Melbourne, Melbourne",IT Jobs,,full_time,,,2025-01-18T11:04:50Z,"You’re only human. It’s a strange thing to say, because us humans are capable of incredible things. And at Medibank, we know our greatest potential lies in the people who work with us. We strive to make real, fundamental change, driven by a simple purpose: to create the best health and wellbeing for all of Australia. The Opportunity This awesome new opportunity sits in the Strategy & Analytics side of the business. Excitingly, you be responsible for the design and implementation of advanced ana…",https://www.adzuna.com.au/land/ad/5015084029?se=ek-0Qjza7xGVJ3wCu-xnLw&utm_medium=api&utm_source=4a3e4881&v=B6884CB56669B5EA25F0651287FC6B3A85BD4A29,2025-01-24 21:31:41
Senior Test Analyst - Data Program,Great Southern Bank,"Brisbane CBD, Brisbane",IT Jobs,contract,full_time,,,2025-01-22T13:10:30Z,"Senior Test Analyst – Data Program Great Southern Bank is seeking a Senior Test Analyst within the Data Program to execute the delivery of multiple projects and initiatives for a 6-month max term contract. This hybrid position is based in our Brisbane CBD office with the flexibility to work from home two days per week. You’ll make an impact by: • Proactively identify, evaluate, and mitigate potential risks and challenges, maintaining a solution-focused mindset throughout the data migration life…",https://www.adzuna.com.au/land/ad/5018999800?se=ek-0Qjza7xGVJ3wCu-xnLw&utm_medium=api&utm_source=4a3e4881&v=C66AAE9471566E74680DB170FC2D8B3A6857B526,2025-01-24 21:31:41
Technical Business Analyst - Data/Pega,HAYS,"Sydney CBD, Sydney",IT Jobs,permanent,full_time,,,2025-01-17T10:59:41Z,"Multiple opportunities for Technical BA's to be part of a high performing team in banking Your new company You'll be a permanent employee of one of the Big 4 Banks as part of their engineering chapter. They are responsible for driving the architecture, design, build and governance roadmap across the bank for different technologies. Your new role You'll provide business analysis services and gather/document information, conduct analysis of business needs through elicitation and management of bus…",https://www.adzuna.com.au/land/ad/5013625443?se=ek-0Qjza7xGVJ3wCu-xnLw&utm_medium=api&utm_source=4a3e4881&v=9C8A3156C9152C2939991698821D7208C93DB8A4,2025-01-24 21:31:41
Salesforce Data Analyst,Cox Purtell,"Mascot, Rockdale Area",Sales Jobs,permanent,full_time,80000,90000,2025-01-24T17:40:21Z,"Sales Data Analyst - Alexandria, NSW - Hybrid - $85k  super Our high-end pharma client and looking to set up their next stage of growth and are looking for a Data Analyst to help their sales team's performance and continue their expansion. They are seeking an analyst to join their sales department and contribute to the efficiency and effectiveness of their sales team. The primary objective of this role is to develop Salesforce effectiveness plans, provide regular analysis reports, and manage th…",https://www.adzuna.com.au/details/5021956419?utm_medium=api&utm_source=4a3e4881,2025-01-24 21:31:41
Senior Data Analyst,MPAU Technology,"Sydney CBD, Sydney",Accounting & Finance Jobs,permanent,full_time,,,2025-01-16T17:54:07Z,"We are seeking a dedicated and analytical Senior Data Analyst to join our Technology department. This role will require a discerning eye for detail, a passion for data-driven decision making, and a strong understanding of technology and telecoms industry trends. Client Details Our client is a corporate health and fitness organisation providing its members and their families with access to a wide choice of fitness facilities. We work with the public sector, corporate employers and leading fitnes…",https://www.adzuna.com.au/details/5012758020?utm_medium=api&utm_source=4a3e4881,2025-01-24 21:31:41
Senior Data Analyst,Mane Consulting,"Sydney, Sydney Region",IT Jobs,,full_time,208000,260000,2025-01-16T03:46:29Z,"Feel empowered in this Innovative team with AI and data analytics in its DNA. You'll drive results that combines cutting edge advanced analytics and automated AI with an integrated suite of leading tools and technologies. We have an exciting opportunity for a Senior Data Analyst to join a Data Analytics practice within our Financial Services client where you will be at the forefront of providing operational insights and valuable analysis to support the data driven business, developing reporting…",https://www.adzuna.com.au/details/5011645496?utm_medium=api&utm_source=4a3e4881,2025-01-24 21:31:41
Senior Data Analyst,Talenza,"Sydney, Sydney Region",IT Jobs,contract,full_time,234000,252200,2025-01-11T03:42:51Z,"Senior Data Analyst (12-Month Contract) Sydney $970pd  Super 12 months Drive the achievement of this organisations strategic goals by collaborating with stakeholders to analyse, validate, and manage data requirements. This role involves supporting systems changes, business process improvements, policy updates, and managing information. Key Responsibilities: Conduct gap analysis and recommend improvements for operational and data workflows. Analyse and understand the business portfolio, deliveri…",https://www.adzuna.com.au/details/5005587007?utm_medium=api&utm_source=4a3e4881,2025-01-24 21:31:41
Data Analyst (Intern),Transvirtual,"The Rocks, Sydney",IT Jobs,contract,full_time,,,2025-01-22T11:21:00Z,"The Role: We are seeking a Data Analyst with a keen interest in applying data-driven solutions in a commercial setting. You will play a key role in supporting our leadership team, including the GM, Head of Marketing, Sales, and Customer Success, by providing meaningful insights to drive decision-making and business growth. This is a full-time, paid 3-month internship that provides an exciting opportunity to gain hands-on experience in data analysis within a fast-paced commercial environment. Yo…",https://www.adzuna.com.au/details/5018924215?utm_medium=api&utm_source=4a3e4881,2025-01-24 21:31:41
Senior Data Analyst,Victorian Government,"Melbourne CBD, Melbourne",IT Jobs,contract,full_time,,,2025-01-23T16:46:19Z,"SENIOR DATA ANALYST An exciting opportunity is available to join the team at the Australia New Zealand Policing Advisory Agency (ANZPAA) as the Senior Data Analyst (VPS-5). POSITION DESCRIPTION The Senior Data Analyst is responsible for how we deliver and communicate data and insights to the ANZPAA Board (Board) and our policing stakeholders by “bringing to life” a suite of reports, dashboards and tools in a way that allows for seamless access and is easy to both interpret and form recommendati…",https://www.adzuna.com.au/details/5020520319?utm_medium=api&utm_source=4a3e4881,2025-01-24 21:31:41
Data Analyst / Scientist,APS,"Canberra Region, Australian Capital Territory",IT Jobs,,full_time,86542,86542,2025-01-14T17:28:20Z,"Please note: To be eligible for employment with Department of Social Services (the department), you must be an Australian citizen. The Priority Investment Approach section have an exciting opportunity for enthusiastic data analysts/scientists to translate data into meaningful insights to inform policy. The Priority Investment Approach section runs the Priority Investment Approach model, which predicts how Australians will interact with the social security system across their lifetime. The team …",https://www.adzuna.com.au/details/5009636929?utm_medium=api&utm_source=4a3e4881,2025-01-24 21:31:41
Data Analyst / Scientist,APS,"Canberra Region, Australian Capital Territory",IT Jobs,,full_time,94791,94791,2025-01-14T17:28:20Z,"Please note: To be eligible for employment with Department of Social Services (the department), you must be an Australian citizen. The Priority Investment Approach section have an exciting opportunity for enthusiastic data analysts/scientists to translate data into meaningful insights to inform policy. The Priority Investment Approach section runs the Priority Investment Approach model, which predicts how Australians will interact with the social security system across their lifetime. The team …",https://www.adzuna.com.au/details/5009636960?utm_medium=api&utm_source=4a3e4881,2025-01-24 21:31:41
